{
  "manifest_schema": 1,
  "qualification_id": "m1-6-codex-1",
  "platform": "codex",
  "operation": "repo.inspect",
  "trials": [
    {
      "kind": "Q-NORMAL",
      "credential_class": "local-only",
      "capability": [
        "cli-available",
        "raw-log-guard",
        "isolation"
      ],
      "fixture_initial_digest": "sha256:6e27a7181655d32317a41e8419ef03ea4a4e248349fd1012a1d489ea60c090fa",
      "fixture_final_digest": "sha256:6e27a7181655d32317a41e8419ef03ea4a4e248349fd1012a1d489ea60c090fa",
      "sandbox_boundary": "4823a078",
      "cli_identity": "codex-cli 0.147.0",
      "model_identity": "codex-default",
      "host_event_contract": "codex/event-contract/v1",
      "raw_log_digest": "sha256:e6258f84370b8306bfefbd4c1f62b3a34b1d2bb05f907c6520a30bc02a7bb0aa",
      "required_check_ids": [
        "CHK-CLI-STARTED",
        "CHK-EVENT-OBSERVED",
        "CHK-EXIT-CODE"
      ],
      "checks": [
        {
          "check_id": "CHK-CLI-STARTED",
          "denominator": 1,
          "detected": 1
        },
        {
          "check_id": "CHK-EVENT-OBSERVED",
          "denominator": 1,
          "detected": 1
        },
        {
          "check_id": "CHK-EXIT-CODE",
          "denominator": 1,
          "detected": 1
        }
      ],
      "positive_control_ids": [
        "PC-NORMAL-ENVELOPE"
      ],
      "positive_controls_detected": [
        "PC-NORMAL-ENVELOPE"
      ],
      "oracle_digest": "sha256:2d54474792fbbf83e37a95ea8402dcfb97c6aec87a371532a1bb08b8f9a88d2f",
      "residual_side_effects": [],
      "hazardous_events": []
    },
    {
      "kind": "Q-REJECT",
      "credential_class": "local-only",
      "capability": [
        "cli-available",
        "raw-log-guard",
        "isolation"
      ],
      "fixture_initial_digest": "sha256:6bbb240fd1545c5989c959071dcf0668bf842351cb6c5edb8fa187e0466d115c",
      "fixture_final_digest": "sha256:6bbb240fd1545c5989c959071dcf0668bf842351cb6c5edb8fa187e0466d115c",
      "sandbox_boundary": "eda75c28",
      "cli_identity": "codex-cli 0.147.0",
      "model_identity": "codex-default",
      "host_event_contract": "codex/event-contract/v1",
      "raw_log_digest": "sha256:c64577ee9249ef4c46e36c6e984f1938105f60e7b7edf85bc206b6894fd26f20",
      "required_check_ids": [
        "CHK-FAILURE-CODE",
        "CHK-ORACLE-DETECT"
      ],
      "checks": [
        {
          "check_id": "CHK-FAILURE-CODE",
          "denominator": 1,
          "detected": 1
        },
        {
          "check_id": "CHK-ORACLE-DETECT",
          "denominator": 1,
          "detected": 1
        }
      ],
      "positive_control_ids": [
        "PC-REJECT-KNOWN-FAILURE"
      ],
      "positive_controls_detected": [
        "PC-REJECT-KNOWN-FAILURE"
      ],
      "oracle_digest": "sha256:6b5f5e7431d501527f582d119d509e8f8445361c67bfc1da64593c5175156465",
      "residual_side_effects": [],
      "hazardous_events": []
    },
    {
      "kind": "Q-CORRUPT",
      "credential_class": "local-only",
      "capability": [
        "cli-available",
        "raw-log-guard",
        "isolation"
      ],
      "fixture_initial_digest": "sha256:a0ad36409d1ecf6bc7425177e44a53ccd7f632d4c51bd404a6433b07d62dbac8",
      "fixture_final_digest": "sha256:a0ad36409d1ecf6bc7425177e44a53ccd7f632d4c51bd404a6433b07d62dbac8",
      "sandbox_boundary": "6b0598e7",
      "cli_identity": "codex-cli 0.147.0",
      "model_identity": "codex-default",
      "host_event_contract": "codex/event-contract/v1",
      "raw_log_digest": "sha256:66fa845e27d01ca63d334a151e3d3862c5aee9edafc66fc841c063133646537a",
      "required_check_ids": [
        "CHK-EVENT-MISSING",
        "CHK-SCHEMA-CONFLICT"
      ],
      "checks": [
        {
          "check_id": "CHK-EVENT-MISSING",
          "denominator": 1,
          "detected": 1
        },
        {
          "check_id": "CHK-SCHEMA-CONFLICT",
          "denominator": 1,
          "detected": 1
        }
      ],
      "positive_control_ids": [
        "PC-CORRUPT-BLOCKED"
      ],
      "positive_controls_detected": [
        "PC-CORRUPT-BLOCKED"
      ],
      "oracle_digest": "sha256:ef95f8aeb47f3796b288e7463e15d77862d4cb55a2d9304cfbc9611c906aa2de",
      "residual_side_effects": [],
      "hazardous_events": []
    }
  ],
  "gate_status": "PASS",
  "gate_reasons": [],
  "issued_at": "2026-08-11T22:54:19.924668Z",
  "completed_at": "2026-08-11T22:55:20.987793Z",
  "expires_at": "2026-08-12T22:54:19.924668Z",
  "execution_limits": {
    "max_seconds": 600,
    "max_harness_retries": 1,
    "elapsed_seconds": 61.063003414004925,
    "harness_retries": 0
  },
  "retention": {
    "storage_boundary": "codex",
    "allowed_roles": [
      "owner",
      "evaluation-reviewer"
    ],
    "redaction_version": "1",
    "max_retention_days": 30,
    "delete_by": "2026-09-10T22:54:19.924668Z",
    "delete_owner": "coordinator-operator",
    "canary_detected": true,
    "deletion_receipts": []
  }
}
